<?xml version="1.0" encoding="UTF-8"?>

<!ELEMENT games (game)+>
<!ELEMENT game (name, company, year, type)>
<!ATTLIST game id CDATA #REQUIRED>
<!ELEMENT name (#PCDATA)>
<!ELEMENT company (#PCDATA)>
<!ELEMENT year (#PCDATA)>
<!ELEMENT type (#PCDATA)>